{
  "id": 42,
  "name": "Production Web Servers",
  "description": "All production web server hosts across US-East region.",
  "organization": 1,
  "kind": "",
  "host_filter": "",
  "variables": "{\"ansible_user\": \"deploy\", \"ansible_port\": 22}",
  "total_hosts": 24,
  "hosts_with_active_failures": 0,
  "total_groups": 4,
  "has_inventory_sources": false,
  "created": "2026-01-01T00:00:00Z",
  "modified": "2026-04-19T00:00:00Z"
}
